<?xml version="1.0" encoding="UTF-8"?>
<!--Sample XML file generated by XMLSpy v2015 sp1 (x64) (http://www.altova.com)-->
<ShowMarks xmlns="http://www.auditions.com/my-data" xmlns:xsi="http://www.w3.org/2001/XMLSchema-instance" xsi:schemaLocation="http://www.auditions.com/my-data db1.xsd">
<showJudge>
        <showJudgeId> 1 </showJudgeId>
        <showId> 1 </showId>
        <judgeId> 1</judgeId></showJudge><showJudge>
        <showJudgeId> 2 </showJudgeId>
        <showId> 1 </showId>
        <judgeId> 2</judgeId></showJudge><showJudge>
        <showJudgeId> 3 </showJudgeId>
        <showId> 1 </showId>
        <judgeId> 3</judgeId></showJudge><showJudge>
        <showJudgeId> 4 </showJudgeId>
        <showId> 2 </showId>
        <judgeId> 1</judgeId></showJudge><showJudge>
        <showJudgeId> 5 </showJudgeId>
        <showId> 2 </showId>
        <judgeId> 4</judgeId></showJudge><showJudge>
        <showJudgeId> 6 </showJudgeId>
        <showId> 3 </showId>
        <judgeId> 3</judgeId></showJudge><showJudge>
        <showJudgeId> 7 </showJudgeId>
        <showId> 3 </showId>
        <judgeId> 4</judgeId></showJudge><showJudge>
        <showJudgeId> 8 </showJudgeId>
        <showId> 3 </showId>
        <judgeId> 5</judgeId></showJudge><showJudge>
        <showJudgeId> 9 </showJudgeId>
        <showId> 4 </showId>
        <judgeId> 2</judgeId></showJudge><showJudge>
        <showJudgeId> 10 </showJudgeId>
        <showId> 4 </showId>
        <judgeId> 5</judgeId></showJudge><showJudge>
        <showJudgeId> 11 </showJudgeId>
        <showId> 5 </showId>
        <judgeId> 2</judgeId></showJudge><showJudge>
        <showJudgeId> 12 </showJudgeId>
        <showId> 5 </showId>
        <judgeId> 3</judgeId></showJudge><showJudge>
        <showJudgeId> 13 </showJudgeId>
        <showId> 5 </showId>
        <judgeId> 4</judgeId>
    </showJudge>

</ShowMarks>
