<?xml version="1.0" encoding="UTF-8"?>
<!--Sample XML file generated by XMLSpy v2015 sp1 (x64) (http://www.altova.com)-->
<ShowMarks xmlns="http://www.auditions.com/my-data" xmlns:xsi="http://www.w3.org/2001/XMLSchema-instance" xsi:schemaLocation="http://www.auditions.com/my-data db1.xsd">

 <showDetails>
        <showId> 1</showId>
        <showName> Show1</showName>
        <showDate> 20140202</showDate></showDetails><showDetails>
        <showId> 2</showId>
        <showName> Show2</showName>
        <showDate> 20140402</showDate></showDetails><showDetails>
        <showId> 3</showId>
        <showName> Show3</showName>
        <showDate> 20140602</showDate></showDetails><showDetails>
        <showId> 4</showId>
        <showName> Show4</showName>
        <showDate> 20140802</showDate></showDetails><showDetails>
        <showId> 5</showId>
        <showName> Show5</showName>
        <showDate> 20141002</showDate>
    </showDetails>

</ShowMarks>
