<?xml version="1.0" encoding="UTF-8"?>
<!--Sample XML file generated by XMLSpy v2015 sp1 (x64) (http://www.altova.com)-->
<ShowMarks xmlns="http://www.auditions.com/my-data" xmlns:xsi="http://www.w3.org/2001/XMLSchema-instance" xsi:schemaLocation="http://www.auditions.com/my-data db1.xsd">
<contestant>
        <contestantId> 1</contestantId>
        <contestantName> Joe </contestantName></contestant><contestant>
        <contestantId> 2</contestantId>
        <contestantName> Bob </contestantName></contestant><contestant>
        <contestantId> 3</contestantId>
        <contestantName> Mary </contestantName></contestant><contestant>
        <contestantId> 4</contestantId>
        <contestantName> Ann </contestantName></contestant><contestant>
        <contestantId> 5</contestantId>
        <contestantName> Bess </contestantName></contestant><contestant>
        <contestantId> 6</contestantId>
        <contestantName> Tom </contestantName></contestant><contestant>
        <contestantId> 7</contestantId>
        <contestantName> Don </contestantName>
    </contestant>
    </ShowMarks>