<?xml version="1.0" encoding="UTF-8"?>
<!--Sample XML file generated by XMLSpy v2015 sp1 (x64) (http://www.altova.com)-->
<ShowMarks xmlns="http://www.auditions.com/my-data" xmlns:xsi="http://www.w3.org/2001/XMLSchema-instance" xsi:schemaLocation="http://www.auditions.com/my-data db1.xsd">
<piece>
        <pieceId> 1</pieceId>
        <pieceName> Barcarolle</pieceName> </piece> <piece>
        <pieceId> 2</pieceId>
        <pieceName> Giselle</pieceName></piece> <piece>
        <pieceId> 3</pieceId>
        <pieceName> The Tramp</pieceName></piece> <piece>
        <pieceId> 4</pieceId>
        <pieceName> Besame Mucho</pieceName></piece> <piece>
        <pieceId> 5</pieceId>
        <pieceName> Swan Lake</pieceName></piece> <piece>
        <pieceId> 6</pieceId>
        <pieceName> Habanera</pieceName>
    </piece>
    </ShowMarks>