<?xml version="1.0" encoding="UTF-8"?>
<!--Sample XML file generated by XMLSpy v2015 sp1 (x64) (http://www.altova.com)-->
<ShowMarks xmlns="http://www.auditions.com/my-data" xmlns:xsi="http://www.w3.org/2001/XMLSchema-instance" xsi:schemaLocation="http://www.auditions.com/my-data db1.xsd">
 <judge>
        <judgeId> 1</judgeId>
        <judgeName> Judy</judgeName></judge><judge>
        <judgeId> 2</judgeId>
        <judgeName> Lucy</judgeName></judge><judge>
        <judgeId> 3</judgeId>
        <judgeName> Irving</judgeName></judge><judge>
        <judgeId> 4</judgeId>
        <judgeName> Phil</judgeName></judge><judge>
        <judgeId> 5</judgeId>
        <judgeName> Oscar</judgeName>
    </judge>
</ShowMarks>
